{
  "contractVersion": "1.0.0",
  "deploymentSnapshotId": "deployment_snapshot_01K2S",
  "environment": "production",
  "resourceVersions": [
    {
      "kind": "agent",
      "ref": "procurement-order-agent@5.2.0",
      "digest": "sha256:agent..."
    },
    {
      "kind": "workflow",
      "ref": "procurement-order@3.0.0",
      "digest": "sha256:workflow..."
    },
    {
      "kind": "model_routing_profile",
      "ref": "eu-enterprise-models@3.0.0",
      "digest": "sha256:modelroute..."
    },
    {
      "kind": "policy_bundle",
      "ref": "procurement-production-policy@7.0.0",
      "digest": "sha256:policy..."
    },
    {
      "kind": "hard_gate_registry",
      "ref": "enterprise-agent-safety@1.0.0",
      "digest": "sha256:gates..."
    }
  ],
  "packageInstallations": [
    {
      "installationId": "package_installation_01K2I",
      "revision": 7,
      "digest": "sha256:installation...",
      "packageLockDigest": "sha256:package-lock..."
    }
  ],
  "contractVersions": {
    "runtime": "1.0.0",
    "events": "1.0.0",
    "manifests": "1.0.0",
    "apiProfile": "1.0.0",
    "eventProfile": "1.0.0",
    "mcpProfile": "2025-11-25",
    "a2aProfile": "1.0",
    "durableBackendProfile": "1.0.0"
  },
  "validFrom": "2026-07-12T08:00:00Z",
  "expiresAt": "2026-08-12T08:00:00Z",
  "digest": "sha256:deployment...",
  "signatureRef": "sigstore://bundle/sha256/deployment-signature...",
  "provenanceRef": "provenance://sha256/deployment-provenance..."
}